{
  "$schema": "../schemas/layout-recipe.schema.json",
  "meta": {
    "id": "application-shell",
    "name": "Application Shell",
    "version": "1.1.0",
    "status": "stable",
    "category": "shell",
    "description": "Persistent authenticated application structure with global navigation, account context, utilities, and a controlled content canvas.",
    "owner": "frontend-product-builder",
    "source": "assets/recipes/application-shell.recipe.json",
    "tags": [
      "authenticated",
      "navigation",
      "application-frame",
      "responsive-shell"
    ]
  },
  "purpose": "Provide a predictable authenticated environment that preserves global navigation and user context while giving product screens a consistent content canvas and scroll model.",
  "useWhen": [
    "The product contains several authenticated routes.",
    "Users need persistent access to primary product areas.",
    "Tenant, organization, workspace, or account context must remain visible.",
    "Product screens share global utilities and identity controls."
  ],
  "doNotUseWhen": [
    "The route is a focused authentication or account-recovery screen.",
    "The product is a single isolated page without persistent navigation.",
    "A public marketing or documentation experience is being created.",
    "The workflow requires a distraction-free full-screen mode and explicitly replaces the shell."
  ],
  "requiredInputs": [
    "Approved information architecture",
    "Approved route groups",
    "Approved authentication behavior",
    "Approved tenant or organization context",
    "Approved design direction",
    "Approved navigation component contracts"
  ],
  "screenContract": {
    "requiredFields": [
      "purpose",
      "primaryUser",
      "primaryTask",
      "route",
      "permissions",
      "responsiveTransformations",
      "accessibilityRequirements",
      "acceptanceCriteria"
    ],
    "selectionQuestions": [
      "Which global product areas require persistent navigation?",
      "Does organization or tenant context affect all route data?",
      "Who owns vertical scrolling: the browser document or the application content canvas?",
      "Which utilities must remain globally available?",
      "Which routes intentionally suppress or replace the application shell?"
    ]
  },
  "regions": [
    {
      "id": "primaryNavigation",
      "name": "Primary Navigation",
      "role": "Provide persistent access to major product areas using user-oriented grouping.",
      "required": true,
      "order": 1,
      "cardinality": {
        "minimum": 1,
        "maximum": 1
      },
      "contentPriority": "primary",
      "allowedComponents": [
        "SidebarNavigation",
        "NavigationRail",
        "MobileNavigationDrawer",
        "NavigationGroup",
        "NavigationItem",
        "Brand",
        "Logo"
      ],
      "prohibitedComponents": [
        "Feature-specific forms",
        "Dashboard metrics",
        "Raw backend module lists",
        "Brand markup inlined outside the isolated Brand/Logo component"
      ],
      "ownsSpacing": true,
      "surface": "surface",
      "landmark": "nav",
      "labelRequirement": "accessible-label",
      "sticky": {
        "enabled": true,
        "container": "application viewport",
        "offsetToken": "reference.space.0",
        "zIndexToken": "reference.zIndex.sticky",
        "compactBehavior": "Transform into an off-canvas navigation drawer."
      },
      "scroll": {
        "ownership": "region",
        "axis": "vertical",
        "notes": "Navigation may scroll independently only when its item count exceeds the viewport."
      },
      "visibilityCondition": "Visible on authenticated product routes.",
      "responsive": {
        "compact": {
          "display": "overlay",
          "placement": "Off-canvas drawer triggered from the global header.",
          "layout": "Single vertical navigation column.",
          "width": "min(88vw, 320px)",
          "order": 1,
          "overflow": "scroll-y",
          "notes": "Focus must be trapped while the drawer is open and restored to the trigger on close."
        },
        "medium": {
          "display": "visible",
          "placement": "Persistent compact navigation rail.",
          "layout": "Icon plus accessible tooltip or expandable label pattern.",
          "width": "72px",
          "order": 1,
          "overflow": "scroll-y",
          "notes": "Current destination must not depend only on color."
        },
        "wide": {
          "display": "visible",
          "placement": "Persistent left sidebar.",
          "layout": "Grouped icon and label navigation.",
          "width": "256px",
          "order": 1,
          "overflow": "scroll-y",
          "notes": "The sidebar must not consume the page content scroll."
        },
        "ultrawide": {
          "display": "visible",
          "placement": "Persistent left sidebar.",
          "layout": "Grouped icon and label navigation with optional secondary metadata.",
          "width": "272px",
          "order": 1,
          "overflow": "scroll-y",
          "notes": "Do not widen the navigation merely because more viewport width exists."
        }
      },
      "rules": [
        "Navigation is organized by user tasks and product areas rather than database entities.",
        "The active route is clearly indicated through text, shape, or icon in addition to color.",
        "Navigation labels must support localization expansion.",
        "Destructive or administrative actions do not appear as ordinary primary navigation items."
      ]
    },
    {
      "id": "globalHeader",
      "name": "Global Header",
      "role": "Provide compact global orientation, navigation trigger, account context, and approved utilities.",
      "required": true,
      "order": 2,
      "cardinality": {
        "minimum": 1,
        "maximum": 1
      },
      "contentPriority": "supporting",
      "allowedComponents": [
        "GlobalHeader",
        "MobileNavigationTrigger",
        "OrganizationSwitcher",
        "GlobalSearch",
        "NotificationTrigger",
        "UserMenu",
        "Brand",
        "Logo"
      ],
      "prohibitedComponents": [
        "Page-specific primary actions",
        "Large marketing content",
        "Repeated route title when the page header already owns it",
        "Brand markup inlined outside the isolated Brand/Logo component"
      ],
      "ownsSpacing": true,
      "surface": "surface",
      "landmark": "header",
      "labelRequirement": "not-required",
      "sticky": {
        "enabled": true,
        "container": "application content frame",
        "offsetToken": "reference.space.0",
        "zIndexToken": "reference.zIndex.sticky",
        "compactBehavior": "Remain visible with reduced utilities and an overflow menu."
      },
      "scroll": {
        "ownership": "none",
        "axis": "none"
      },
      "visibilityCondition": "Visible on authenticated product routes.",
      "responsive": {
        "compact": {
          "display": "visible",
          "placement": "Top of viewport.",
          "layout": "Navigation trigger, compact product identity, context summary, user menu.",
          "width": "100%",
          "order": 1,
          "overflow": "move-to-overflow",
          "notes": "Global search may move to a dedicated overlay or route."
        },
        "medium": {
          "display": "visible",
          "placement": "Top of application content.",
          "layout": "Context, compact utilities, and user menu.",
          "width": "100%",
          "order": 1,
          "overflow": "move-to-overflow",
          "notes": "Hide low-frequency utility labels before removing their accessible names."
        },
        "wide": {
          "display": "visible",
          "placement": "Top of application content.",
          "layout": "Horizontal global utility bar.",
          "width": "100%",
          "order": 1,
          "overflow": "visible",
          "notes": "Keep the header compact in operational products."
        },
        "ultrawide": {
          "display": "visible",
          "placement": "Top of application content.",
          "layout": "Horizontal global utility bar.",
          "width": "100%",
          "order": 1,
          "overflow": "visible",
          "notes": "Do not add decorative empty space."
        }
      },
      "rules": [
        "The global header remains visually subordinate to route content.",
        "Page-specific actions belong to the page recipe unless explicitly global.",
        "Organization or tenant switching must trigger safe context reset and cache isolation.",
        "Icon-only utilities require accessible names."
      ]
    },
    {
      "id": "contentCanvas",
      "name": "Content Canvas",
      "role": "Host route-level screen recipes inside a consistent width, spacing, and scrolling environment.",
      "required": true,
      "order": 3,
      "cardinality": {
        "minimum": 1,
        "maximum": 1
      },
      "contentPriority": "primary",
      "allowedComponents": [
        "RouteOutlet",
        "PageContainer",
        "RouteErrorBoundary",
        "RouteLoadingBoundary"
      ],
      "prohibitedComponents": [
        "Duplicate global navigation",
        "Duplicate user menu",
        "Global context switcher reimplementation"
      ],
      "ownsSpacing": false,
      "surface": "canvas",
      "landmark": "main",
      "labelRequirement": "inherited",
      "sticky": {
        "enabled": false
      },
      "scroll": {
        "ownership": "application-canvas",
        "axis": "vertical",
        "notes": "The application must use one primary vertical content scroll container."
      },
      "visibilityCondition": "Always visible when the authenticated shell is active.",
      "responsive": {
        "compact": {
          "display": "visible",
          "placement": "Below the global header.",